[I 2023-10-25 07:55:47,151] Trial 99 pruned. 
Number of finished trials:  100
Best trial:
  Value:  -83.95148959999999
  Params: 
    gamma: 0.9
    learning_rate: 0.003917598160757259
    batch_size: 512
    buffer_size: 1000000
    learning_starts: 0
    train_freq: 512
    tau: 0.08
    net_arch: medium
  User attrs:
FINISHED!

